{
  "config_coupling": {
    "effect": "Without a nonempty CLI database override, the database path is XDG_DATA_HOME/concord/concord.db when XDG_DATA_HOME is nonempty, otherwise HOME/.local/share/concord/concord.db. Resolution refuses when neither data home nor user home is available; database admission remains a separate check.",
    "environments": ["development", "production", "test"],
    "read_by": {
      "path": "internal/store/store.go",
      "project_id": "concord",
      "symbol": "DefaultPath"
    },
    "setting": "XDG_DATA_HOME",
    "source": "Process environment XDG_DATA_HOME, falling back to os.UserHomeDir when unset or empty; the CLI calls this resolver only when CONCORD_DB_PATH is empty."
  },
  "id": "database-default-path",
  "kind": "config_coupling",
  "owner_domain_id": "durable-authority",
  "owning_root": "internal/store",
  "schema_version": "1.0",
  "standing": "observed"
}
