{
  "config_coupling": {
    "effect": "Ordinary authority transactions use NORMAL. Durable admission pins a connection, sets FULL before BEGIN and verifies level 2 before proceeding. Release restores NORMAL; if restoration fails, it discards the connection rather than returning it to the pool.",
    "environments": ["development", "production", "test"],
    "read_by": {
      "path": "internal/store/internal/sqlitedb/write.go",
      "project_id": "concord",
      "symbol": "BeginWrite"
    },
    "setting": "synchronous",
    "source": "The authority DSN uses the compile-time synchronous constant NORMAL. BeginWrite selects FULL only for durable admission; releaseDurableConn resets that connection to NORMAL. These are fixed code values, not an environment override."
  },
  "id": "sqlite-synchronous",
  "kind": "config_coupling",
  "owner_domain_id": "durable-authority",
  "owning_root": "internal/store/internal/sqlitedb",
  "schema_version": "1.0",
  "standing": "observed"
}
