{
  "config_coupling": {
    "effect": "The authority DSN applies journal_mode(WAL) to each connection. Store open verifies that the live connection reports wal and refuses a mismatch. The read-only backup and readiness DSNs do not select a journal mode.",
    "environments": ["development", "production", "test"],
    "read_by": {
      "path": "internal/store/internal/sqlitedb/connection.go",
      "project_id": "concord",
      "symbol": "DSN"
    },
    "setting": "journal_mode",
    "source": "Compile-time sqlitedb journalMode constant WAL; no deployment setting changes this DSN value."
  },
  "id": "sqlite-journal-mode",
  "kind": "config_coupling",
  "owner_domain_id": "durable-authority",
  "owning_root": "internal/store/internal/sqlitedb",
  "schema_version": "1.0",
  "standing": "observed"
}
